Product ID;Nombre;Referencia;Cantidad;Stock
58;Parrilla a Gas Broil King - GEM 340;814163;0;0
59;Parrilla a Gas Broil King - CROWN 440;982163;1;36
60;Parrilla a Gas Broil King - BARON 590;923983;1;13
62;Parrilla a Gas Broil King - REGAL S590;998383;1;14
63;Parrilla a Gas Broil King - REGAL 420 BUILT IN;985653;1;4
64;Parrilla a Carbón Broil King - KEG 2000;911050;0;0
65;Parrilla a Carbón Broil King - KEG 5000;911470;0;0
66;Ahumador de Carbón Vertical Broil King;923610;1;8
67;Parrilla Ahumador de Carbón Broil King;948050;0;0
68;Cobertor de Parrilla Broil King KEG 2000;ka5544;1;5
69;Cobertor de Parrilla Broil King 500 Series Imperial / Regal;68492;1;14
70;Cobertor de Parrilla Broil King 500 Series Baron;68488;1;17
71;Cobertor de Ahumador Vertical Broil King;67240;1;9
72;Cobertor de Parrilla Broil King 400 Series Crown / Sovereign / Baron;67487;1;38
73;Cobertor de Parrilla Broil King Built in 490;68591;1;5
74;Cepillo y tazón para rociar Broil King;61490;1;0
75;Juego De Herramientas Para Asar Broil King Baron;64003;1;22
76;Juego De Herramientas Para Asar Broil King Porta Chef;64001;1;19
77;Volteador Para Parrillas Broil King;64031;1;6
78;Super Flipper Broil King;64010;1;18
79;Pinza Para Parrilla Broil King;64012;1;3
80;Cepillo Para Rociar Broil King;64013;1;8
81;Cepillo Para Parrilla Extra Largo Broil King;65641;1;0
82;Set De Mantenimiento De Quemadores A Gas Broil King;64310;1;18
83;Cepillo De Parrilla Con Cabeza Reemplazable Broil King;77610;1;3
84;Cepillo De Parrilla Broil King;65225;1;0
85;Elevador De Parrilla Broil King;60745;1;16
86;Asador De Pollo Broil King;69133;1;13
87;Plato Hondo Grill Wok Broil King;69822;1;6
88;Plancha Estrecha Broil King;69122;1;12
89;Asador De Costillas De Hierro Broil King;69615;1;3
90;Bandeja Para Asar Broil King;63106;1;43
91;Canasta Para Asar Broil King;65070;1;0
92;Garras Para Carne Broil King;64070;1;12
93;Roaster Pepper Broil King;69155;0;10
94;Topper Flat Broil King;69720;1;4
95;Topper Narrow Broil King;69722;1;9
96;Sartén De Hierro Fundido Broil King;91658;1;4
97;Prensa Para Hamburguesas Broil King;24795;1;42
98;Plancha De Hierro Broil King Porta Chef;11237;1;8
99;Plancha De Hierro Broil King Imperial / Regal;11239;1;0
100;Paquete De 2 Tapetes Antiadherentes Para Cocinar Broil King;11239;1;0
101;Juego de parrillas de cocción de barril de hierro fundido Broil King;ka5545;1;0
102;Encendedor De Carbón Broil King;39470;1;17
103;Alfombrilla De Silicona Para Estantes Laterales Broil King;60009;1;21
104;Guantes De Cuero Broil King;60528;1;70
105;Termómetro Digital De Mesa Auxiliar Broil King;61935;1;0
106;Termómetro De Lectura Instantánea Broil King;61825;1;0
107;Termómetro Bluetooth Broil King;13975;1;15
108;Oil Mister Broil King;60940;1;11
109;Inyector De Marinado Broil King;61495;1;4
110;Caja Ahumadora Broil King;60185;1;9
111;Caja Ahumadora Premium Broil King;60190;1;14
128;Argent Willow 4 Piece Forged Steak Knife;ACF16K04SB;1;7
129;Willow 18/10 5 Piece Set;AFF75M05AR;1;15
130;Olivia Mirror Hammered 18/10 Forged 5Pc Set;AFF85S05QJ;1;9
131;Tomodachi 1 Piece Medium Non-Slip Poly Board;HMB02P01MB;1;50
132;Tomodachi 1 Piece Small Non-Slip Poly Board;HMB02P01SB;1;54
133;Tomodachi 2 Piece Bamboo Cutting Board Set;HMB02W02BB;1;27
134;Cuchillos Para Carne Continental - 4 Piezas;HMC01A033F;1;32
135;"Kobe 8"" Chef Knife / Clampack";HMC01A052C;1;12
136;Marburg Shears In Envelope;HMC01A067A;1;14
137;Argentum Red 4Pc Steak Set In Envelope;HMC01A077S;1;25
138;Claridge 4Pc Steak Set In Envelope;HMC01A095A;1;20
139;Knight 4Pc Steak Set In Envelope;HMC01A192D;1;24
140;Knight 3Pc Cutlery Set In Envelope Eng/Fr;HMC01A192F;1;8
141;Kenai 3Pc Santoku Set In Gift Box;HMC01A220D;1;16
142;Ariston 2Pc Carving Set In Wood Box;HMC01A266A;1;14
143;Argentum Black Soft Grip 4Pc Steak In Envelope;HMC01A271I;1;24
144;Galactic 2Pc Prep Set In Wooden Box;HMC01A288A;1;12
145;"Kobe 8"" Chef With Clear Blade Guard";HMC01A455G;1;53
146;"Kobe 3.5"" Parer With Clear Blade Guard";HMC01A456G;1;29
147;"Kobe 5.5"" Santoku With Clear Blade Guard";HMC01A457G;1;13
148;"Kobe 8"" Bread Knife In Clear Blade Guard";HMC01A458G;1;34
149;"Kobe 5"" Serrated Utility";HMC01A463U;1;28
150;Curvature 4Pc Steak Set;HMC01A508A;1;31
151;Curvature 4Pc Cheese Set;HMC01A508B;1;25
152;Curvature 3Pc Cutlery Set;HMC01A508C;1;22
153;Essen 12Pc Cutlery Set;HMC01A582R;1;37
154;Luminous 3Pc Cutlery Set Envelope;HMC01A630E;1;15
155;Norwood 13Pc Block Set;HMC01B444A;1;4
156;"Dura-Ceramica 6"" Chef (Red) W/Bg";HMC01C100CS;1;42
157;"Dura-Ceramica 5"" (Green) Santoku W/Bg";HMC01C100TS;1;47
158;"Dura-Ceramica 5"" Utility (Orange) W/Bg";HMC01C100US;1;46
159;Skandia Iceland 6 Piece Block Set;SCS286B06D;1;2
160;Tidal Frosted (Forged) 18/0 5Pc Set;SFB86F05SN;1;14
161;Birch 20Pc Set;SFC27520SK;1;3
162;Mirabella 18/0 20Pc Set;SFF30M20SB;1;6
163;Opera Black Titanium 5Pc 18/0;SFQ35705SK;1;10
